[
  {
    "correction_version": 1,
    "date": "2026-07-31",
    "direction": null,
    "formula_version": "v1",
    "linked_snapshot_id": "2026-07-31-snapshot",
    "observation_id": "2026-07-31-temp",
    "observed_at": "2026-07-31T08:53:23+09:00",
    "previous_status": null,
    "reason_codes": null,
    "reason_text": null,
    "score": null,
    "status": "risk_on"
  },
  {
    "correction_version": 1,
    "date": "2026-08-01",
    "direction": "unchanged",
    "formula_version": "v1",
    "linked_snapshot_id": "2026-08-01-snapshot",
    "observation_id": "2026-08-01-temp",
    "observed_at": "2026-08-01T06:44:07+09:00",
    "previous_status": "risk_on",
    "reason_codes": null,
    "reason_text": null,
    "score": null,
    "status": "risk_on"
  },
  {
    "correction_version": 1,
    "date": "2026-08-03",
    "direction": "unchanged",
    "formula_version": "v1",
    "linked_snapshot_id": "2026-08-03-snapshot",
    "observation_id": "2026-08-03-temp",
    "observed_at": "2026-08-03T06:43:26+09:00",
    "previous_status": "risk_on",
    "reason_codes": null,
    "reason_text": null,
    "score": null,
    "status": "risk_on"
  },
  {
    "correction_version": 1,
    "date": "2026-08-04",
    "direction": "worsened",
    "formula_version": "v1",
    "linked_snapshot_id": "2026-08-04-snapshot",
    "observation_id": "2026-08-04-temp",
    "observed_at": "2026-08-04T06:43:49+09:00",
    "previous_status": "risk_on",
    "reason_codes": null,
    "reason_text": null,
    "score": null,
    "status": "neutral"
  },
  {
    "correction_version": 1,
    "date": "2026-08-05",
    "direction": "unchanged",
    "formula_version": "v1",
    "linked_snapshot_id": "2026-08-05-snapshot",
    "observation_id": "2026-08-05-temp",
    "observed_at": "2026-08-05T06:43:34+09:00",
    "previous_status": "neutral",
    "reason_codes": null,
    "reason_text": null,
    "score": null,
    "status": "neutral"
  },
  {
    "correction_version": 1,
    "date": "2026-08-07",
    "direction": "worsened",
    "formula_version": "v1",
    "linked_snapshot_id": "2026-08-07-snapshot",
    "observation_id": "2026-08-07-temp",
    "observed_at": "2026-08-07T06:43:26+09:00",
    "previous_status": "neutral",
    "reason_codes": null,
    "reason_text": null,
    "score": null,
    "status": "cautious"
  },
  {
    "correction_version": 1,
    "date": "2026-08-08",
    "direction": "improved",
    "formula_version": "v1",
    "linked_snapshot_id": "2026-08-08-snapshot",
    "observation_id": "2026-08-08-temp",
    "observed_at": "2026-08-08T08:33:29+09:00",
    "previous_status": "cautious",
    "reason_codes": null,
    "reason_text": null,
    "score": null,
    "status": "neutral"
  },
  {
    "correction_version": 1,
    "date": "2026-08-10",
    "direction": "unchanged",
    "formula_version": "v1",
    "linked_snapshot_id": "2026-08-10-snapshot",
    "observation_id": "2026-08-10-temp",
    "observed_at": "2026-08-10T06:43:18+09:00",
    "previous_status": "neutral",
    "reason_codes": null,
    "reason_text": null,
    "score": null,
    "status": "neutral"
  },
  {
    "correction_version": 1,
    "date": "2026-08-11",
    "direction": "unchanged",
    "formula_version": "v1",
    "linked_snapshot_id": "2026-08-11-snapshot",
    "observation_id": "2026-08-11-temp",
    "observed_at": "2026-08-11T06:43:15+09:00",
    "previous_status": "neutral",
    "reason_codes": null,
    "reason_text": null,
    "score": null,
    "status": "neutral"
  },
  {
    "correction_version": 1,
    "date": "2026-08-12",
    "direction": "improved",
    "formula_version": "v1",
    "linked_snapshot_id": "2026-08-12-snapshot",
    "observation_id": "2026-08-12-temp",
    "observed_at": "2026-08-12T06:43:01+09:00",
    "previous_status": "neutral",
    "reason_codes": null,
    "reason_text": null,
    "score": null,
    "status": "risk_on"
  },
  {
    "correction_version": 1,
    "date": "2026-08-14",
    "direction": "unchanged",
    "formula_version": "v1",
    "linked_snapshot_id": "2026-08-14-snapshot",
    "observation_id": "2026-08-14-temp",
    "observed_at": "2026-08-14T06:43:16+09:00",
    "previous_status": "risk_on",
    "reason_codes": null,
    "reason_text": null,
    "score": null,
    "status": "risk_on"
  },
  {
    "correction_version": 1,
    "date": "2026-08-15",
    "direction": "unchanged",
    "formula_version": "v1",
    "linked_snapshot_id": "2026-08-15-snapshot",
    "observation_id": "2026-08-15-temp",
    "observed_at": "2026-08-15T08:29:56+09:00",
    "previous_status": "risk_on",
    "reason_codes": null,
    "reason_text": null,
    "score": null,
    "status": "risk_on"
  },
  {
    "correction_version": 1,
    "date": "2026-08-17",
    "direction": "unchanged",
    "formula_version": "v1",
    "linked_snapshot_id": "2026-08-17-snapshot",
    "observation_id": "2026-08-17-temp",
    "observed_at": "2026-08-17T06:43:46+09:00",
    "previous_status": "risk_on",
    "reason_codes": null,
    "reason_text": null,
    "score": null,
    "status": "risk_on"
  },
  {
    "correction_version": 1,
    "date": "2026-08-18",
    "direction": "unchanged",
    "formula_version": "v1",
    "linked_snapshot_id": "2026-08-18-snapshot",
    "observation_id": "2026-08-18-temp",
    "observed_at": "2026-08-18T06:43:42+09:00",
    "previous_status": "risk_on",
    "reason_codes": null,
    "reason_text": null,
    "score": null,
    "status": "risk_on"
  },
  {
    "correction_version": 1,
    "date": "2026-08-19",
    "direction": "worsened",
    "formula_version": "v1",
    "linked_snapshot_id": "2026-08-19-snapshot",
    "observation_id": "2026-08-19-temp",
    "observed_at": "2026-08-19T07:33:36+09:00",
    "previous_status": "risk_on",
    "reason_codes": null,
    "reason_text": null,
    "score": null,
    "status": "neutral"
  },
  {
    "correction_version": 1,
    "date": "2026-08-20",
    "direction": "unchanged",
    "formula_version": "v1",
    "linked_snapshot_id": "2026-08-20-snapshot",
    "observation_id": "2026-08-20-temp",
    "observed_at": "2026-08-20T07:18:32+09:00",
    "previous_status": "neutral",
    "reason_codes": null,
    "reason_text": null,
    "score": null,
    "status": "neutral"
  },
  {
    "correction_version": 1,
    "date": "2026-08-21",
    "direction": "unchanged",
    "formula_version": "v1",
    "linked_snapshot_id": "2026-08-21-snapshot",
    "observation_id": "2026-08-21-temp",
    "observed_at": "2026-08-21T06:43:21+09:00",
    "previous_status": "neutral",
    "reason_codes": null,
    "reason_text": null,
    "score": null,
    "status": "neutral"
  },
  {
    "correction_version": 1,
    "date": "2026-08-22",
    "direction": "unchanged",
    "formula_version": "v1",
    "linked_snapshot_id": "2026-08-22-snapshot",
    "observation_id": "2026-08-22-temp",
    "observed_at": "2026-08-22T06:43:25+09:00",
    "previous_status": "neutral",
    "reason_codes": null,
    "reason_text": null,
    "score": null,
    "status": "neutral"
  },
  {
    "correction_version": 1,
    "date": "2026-08-23",
    "direction": "unchanged",
    "formula_version": "v1",
    "linked_snapshot_id": "2026-08-23-snapshot",
    "observation_id": "2026-08-23-temp",
    "observed_at": "2026-08-23T07:22:51+09:00",
    "previous_status": "neutral",
    "reason_codes": null,
    "reason_text": null,
    "score": null,
    "status": "neutral"
  },
  {
    "correction_version": 1,
    "date": "2026-08-25",
    "direction": "worsened",
    "formula_version": "v1",
    "linked_snapshot_id": "2026-08-25-snapshot",
    "observation_id": "2026-08-25-temp",
    "observed_at": "2026-08-25T06:43:06+09:00",
    "previous_status": "neutral",
    "reason_codes": null,
    "reason_text": null,
    "score": null,
    "status": "cautious"
  },
  {
    "correction_version": 1,
    "date": "2026-08-26",
    "direction": "improved",
    "formula_version": "v1",
    "linked_snapshot_id": "2026-08-26-snapshot",
    "observation_id": "2026-08-26-temp",
    "observed_at": "2026-08-26T06:44:20+09:00",
    "previous_status": "cautious",
    "reason_codes": null,
    "reason_text": null,
    "score": null,
    "status": "neutral"
  },
  {
    "correction_version": 1,
    "date": "2026-08-27",
    "direction": "unchanged",
    "formula_version": "v1",
    "linked_snapshot_id": "2026-08-27-snapshot",
    "observation_id": "2026-08-27-temp",
    "observed_at": "2026-08-27T06:43:40+09:00",
    "previous_status": "neutral",
    "reason_codes": null,
    "reason_text": null,
    "score": null,
    "status": "neutral"
  },
  {
    "correction_version": 1,
    "date": "2026-08-28",
    "direction": "improved",
    "formula_version": "v1",
    "linked_snapshot_id": "2026-08-28-snapshot",
    "observation_id": "2026-08-28-temp",
    "observed_at": "2026-08-28T06:43:29+09:00",
    "previous_status": "neutral",
    "reason_codes": null,
    "reason_text": null,
    "score": null,
    "status": "risk_on"
  },
  {
    "correction_version": 1,
    "date": "2026-08-29",
    "direction": "worsened",
    "formula_version": "v1",
    "linked_snapshot_id": "2026-08-29-snapshot",
    "observation_id": "2026-08-29-temp",
    "observed_at": "2026-08-29T06:43:15+09:00",
    "previous_status": "risk_on",
    "reason_codes": null,
    "reason_text": null,
    "score": null,
    "status": "cautious"
  },
  {
    "correction_version": 1,
    "date": "2026-09-01",
    "direction": "improved",
    "formula_version": "v1",
    "linked_snapshot_id": "2026-09-01-snapshot",
    "observation_id": "2026-09-01-temp",
    "observed_at": "2026-09-01T06:48:42+09:00",
    "previous_status": "cautious",
    "reason_codes": null,
    "reason_text": null,
    "score": null,
    "status": "neutral"
  },
  {
    "correction_version": 1,
    "date": "2026-09-02",
    "direction": "worsened",
    "formula_version": "v1",
    "linked_snapshot_id": "2026-09-02-snapshot",
    "observation_id": "2026-09-02-temp",
    "observed_at": "2026-09-02T06:45:00+09:00",
    "previous_status": "neutral",